source,title,summary,link,published,author,collected_at
TechCrunch,Govee’s smart nugget ice maker makes every iced drink feel like a luxury,"For some people, the ice in a beverage is almost as important as the drink itself. That&#8217;s the audience Govee had in mind when designing its latest ice maker, the GoveeLife Smart Nugget Ice Maker Pro.&#160;This $500 premium smart home gadget is aimed at those who crave what&#8217;s called “the good ice,” the soft, chewable [&#8230;]",https://techcrunch.com/2026/06/28/govees-smart-nugget-ice-maker-makes-every-iced-drink-feel-like-a-luxury/,"Sun, 28 Jun 2026 14:00:00 +0000",Aisha Malik,2026-06-29 16:28:40
TechCrunch,Indian payments chief thinks AI will be heavily involved in next era of digital payment growth,Dilip Asbe said that newer UPI apps could be more competitive with a viable commercial model,https://techcrunch.com/2026/06/27/indian-payments-chief-thinks-ai-will-be-heavily-involved-in-next-era-of-digital-payment-growth/,"Sun, 28 Jun 2026 05:00:00 +0000",Ivan Mehta,2026-06-29 16:28:40
TechCrunch,Instagram is testing more ways to customize ‘Your Algorithm’,Instagram users could soon see more ways to tune their content.,https://techcrunch.com/2026/06/27/instagram-is-testing-more-ways-for-users-to-customize-your-algorithm/,"Sat, 27 Jun 2026 21:27:37 +0000",Anthony Ha,2026-06-29 16:28:40
TechCrunch,SoftBank’s CEO isn’t the only one with questions about Elon Musk’s orbital data center hype,Not everyone is buying Elon Musk’s vision for orbital data centers.,https://techcrunch.com/2026/06/27/softbanks-ceo-isnt-the-only-one-with-questions-about-elon-musks-orbital-data-center-hype/,"Sat, 27 Jun 2026 20:42:36 +0000",Anthony Ha,2026-06-29 16:28:40
TechCrunch,Apple Vision Pro exec is reportedly leaving for OpenAI,"Paul Meade, the Apple vice president in charge of the Vision Pro headset, is reportedly leaving the company to join OpenAI’s hardware team.",https://techcrunch.com/2026/06/27/apple-vision-pro-exec-is-reportedly-leaving-for-openai/,"Sat, 27 Jun 2026 16:45:09 +0000",Anthony Ha,2026-06-29 16:28:40
TechCrunch,The fittest founder in the room got cancer. Here’s how he used AI to fight back.,"When confronted with cancer, Connor Christou fed everything tied tied to his regime — blood results, scan data, wearable output, journal entries — into Claude.",https://techcrunch.com/2026/06/27/the-fittest-founder-in-the-room-got-cancer-heres-how-he-used-ai-to-fight-back/,"Sat, 27 Jun 2026 14:00:00 +0000",Connie Loizos,2026-06-29 16:28:40
TechCrunch,Asian AI startups launch Mythos-like  models as Anthropic’s export ban drags on,New models are launching in Asia that promise Mythos-like capabilities without fear of an export ban. U.S. AI labs may never recover this enormous market.,https://techcrunch.com/2026/06/27/asian-ai-startups-launch-mythos-like-models-as-anthropics-export-ban-drags-on/,"Sat, 27 Jun 2026 12:00:00 +0000",Kate Park,2026-06-29 16:28:40
TechCrunch,"Trump Admin releases Anthropic Mythos to be used by more than 100 US companies, agencies","Over 100 companies and government agencies are reportedly authorized to use Mythos 5, including their non-American employees.",https://techcrunch.com/2026/06/26/trump-admin-releases-anthropic-mythos-to-be-used-by-more-than-100-us-companies-agencies/,"Sat, 27 Jun 2026 01:01:37 +0000",Julie Bort,2026-06-29 16:28:40
TechCrunch,FTC gives Musk the OK to acquire SpaceX alumni startup Mesh,Mesh came out of stealth in February with a $50 million Series A.,https://techcrunch.com/2026/06/26/ftc-gives-musk-the-ok-to-acquire-spacex-alumni-startup-mesh/,"Sat, 27 Jun 2026 00:38:34 +0000",Marina Temkin,2026-06-29 16:28:40
TechCrunch,"Corgi, the buzzy Y Combinator-backed insurance tech startup, says it didn’t steal an open source product","Corgi became embroiled in  controversy when Papermark accused it of stealing its software. Corgi says it did not, raising new questions about vibe coding.",https://techcrunch.com/2026/06/26/corgi-the-buzzy-y-combinator-backed-insurance-tech-startup-says-it-didnt-steal-an-open-source-product/,"Fri, 26 Jun 2026 22:00:37 +0000",Julie Bort,2026-06-29 16:28:40
TechCrunch,Novak Djokovic has a new job —  advisor to private equity firm General Atlantic,General Atlantic has tapped tennis legend Novak Djokovic to serve as a global strategic advisor.,https://techcrunch.com/2026/06/26/novak-djokovic-has-a-new-job-advisor-to-private-equity-firm-general-atlantic/,"Fri, 26 Jun 2026 19:13:40 +0000",Dominic-Madori Davis,2026-06-29 16:28:40
TechCrunch,"OpenAI limits GPT-5.6 rollout after government request, says restrictions shouldn’t be the norm","“We don’t believe this kind of government access process should become the long-term default,” says OpenAI. “It keeps the best tools from users, developers, enterprises, cyber defenders, and global partners who need them.”",https://techcrunch.com/2026/06/26/openai-limits-gpt-5-6-rollout-after-government-request-says-restrictions-shouldnt-be-the-norm/,"Fri, 26 Jun 2026 18:32:14 +0000",Rebecca Bellan,2026-06-29 16:28:40
TechCrunch,OpenAI poaches Uber India chief to lead its biggest market outside the US,"The hire marks OpenAI's latest push into India, expanding offices, partnerships and hiring.",https://techcrunch.com/2026/06/26/openai-poaches-uber-india-chief-to-lead-its-biggest-market-outside-the-u-s/,"Fri, 26 Jun 2026 18:19:36 +0000",Jagmeet Singh,2026-06-29 16:28:40
TechCrunch,Why everyone from OpenAI to SpaceX is building their own chips (and turning up the heat on Nvidia),"Nvidia has dominated the AI chip market for years, but the era of total dependence might be ending.&#160;&#160; OpenAI just shared its plans to spice things up with&#160;Jalapeño, its custom inference chip built with Broadcom, joining Google, Apple, and SpaceX in a growing list of companies building their way out of single-supplier risk. The goal&#160;is&#160;less&#160;of&#160;a [&#8230;]",https://techcrunch.com/video/why-everyone-from-openai-to-spacex-is-building-their-own-chips-and-turning-up-the-heat-on-nvidia/,"Fri, 26 Jun 2026 17:43:22 +0000",Theresa Loconsolo,2026-06-29 16:28:40
TechCrunch,Russian hackers were behind $2.5B hack of Jaguar Land Rover: Report,"The hack on car giant Jaguar Land Rover last year was one of the most disrupting, damaging, and costly hacks of the last few years.",https://techcrunch.com/2026/06/26/russian-hackers-were-behind-2-5-billion-hack-of-jaguar-land-rover-report/,"Fri, 26 Jun 2026 17:29:29 +0000",Lorenzo Franceschi-Bicchierai,2026-06-29 16:28:40
